[
  {
    "event_id": "EVT-2026-0042",
    "chiller_id": "CH-ATL-003",
    "alarm_code": "A1.01",
    "status": "active",
    "raised_at": "2026-07-17T14:22:18Z",
    "cleared_at": null,
    "circuit": "A",
    "source": "controller",
    "acknowledged": false,
    "acknowledged_by": null
  },
  {
    "event_id": "EVT-2026-0038",
    "chiller_id": "CH-ATL-003",
    "alarm_code": "A1.04",
    "status": "cleared",
    "raised_at": "2025-11-14T09:15:00Z",
    "cleared_at": "2025-11-14T14:30:00Z",
    "circuit": "A",
    "source": "controller",
    "acknowledged": true,
    "acknowledged_by": "TECH-4421"
  },
  {
    "event_id": "EVT-2026-0029",
    "chiller_id": "CH-DAL-002",
    "alarm_code": "215",
    "status": "cleared",
    "raised_at": "2026-07-10T18:45:00Z",
    "cleared_at": "2026-07-10T19:12:00Z",
    "circuit": null,
    "source": "remote_monitoring",
    "acknowledged": true,
    "acknowledged_by": "CCC-ATL"
  },
  {
    "event_id": "EVT-2026-0031",
    "chiller_id": "CH-DAL-002",
    "alarm_code": "207",
    "status": "active",
    "raised_at": "2026-07-16T22:08:00Z",
    "cleared_at": null,
    "circuit": null,
    "source": "controller",
    "acknowledged": true,
    "acknowledged_by": "CCC-DAL"
  },
  {
    "event_id": "EVT-2026-0015",
    "chiller_id": "CH-ATL-001",
    "alarm_code": "B2.03",
    "status": "cleared",
    "raised_at": "2026-06-28T15:30:00Z",
    "cleared_at": "2026-06-28T16:45:00Z",
    "circuit": "B",
    "source": "remote_monitoring",
    "acknowledged": true,
    "acknowledged_by": "TECH-3310"
  },
  {
    "event_id": "EVT-2026-0040",
    "chiller_id": "CH-CHI-004",
    "alarm_code": "C1.12",
    "status": "cleared",
    "raised_at": "2026-07-12T11:00:00Z",
    "cleared_at": "2026-07-12T11:22:00Z",
    "circuit": null,
    "source": "controller",
    "acknowledged": true,
    "acknowledged_by": "TECH-5587"
  },
  {
    "event_id": "EVT-2026-0044",
    "chiller_id": "CH-PHX-005",
    "alarm_code": "Co.A1",
    "status": "active",
    "raised_at": "2026-07-17T12:05:00Z",
    "cleared_at": null,
    "circuit": "A",
    "source": "controller",
    "acknowledged": false,
    "acknowledged_by": null
  },
  {
    "event_id": "EVT-2025-0891",
    "chiller_id": "CH-ATL-003",
    "alarm_code": "A1.01",
    "status": "cleared",
    "raised_at": "2025-11-08T16:42:00Z",
    "cleared_at": "2025-11-09T10:15:00Z",
    "circuit": "A",
    "source": "controller",
    "acknowledged": true,
    "acknowledged_by": "TECH-4421"
  },
  {
    "event_id": "EVT-2025-0620",
    "chiller_id": "CH-DAL-002",
    "alarm_code": "207",
    "status": "cleared",
    "raised_at": "2025-09-22T13:55:00Z",
    "cleared_at": "2025-09-23T11:30:00Z",
    "circuit": null,
    "source": "controller",
    "acknowledged": true,
    "acknowledged_by": "TECH-2890"
  },
  {
    "event_id": "EVT-2024-0412",
    "chiller_id": "CH-DAL-002",
    "alarm_code": "207",
    "status": "cleared",
    "raised_at": "2024-08-14T09:02:00Z",
    "cleared_at": "2024-08-14T17:45:00Z",
    "circuit": null,
    "source": "controller",
    "acknowledged": true,
    "acknowledged_by": "TECH-1845"
  },
  {
    "event_id": "EVT-2025-0188",
    "chiller_id": "CH-PHX-005",
    "alarm_code": "Co.A1",
    "status": "cleared",
    "raised_at": "2025-04-03T16:10:00Z",
    "cleared_at": "2025-04-04T10:00:00Z",
    "circuit": "A",
    "source": "controller",
    "acknowledged": true,
    "acknowledged_by": "TECH-6102"
  },
  {
    "event_id": "EVT-2024-0890",
    "chiller_id": "CH-PHX-005",
    "alarm_code": "Co.A1",
    "status": "cleared",
    "raised_at": "2024-11-18T08:30:00Z",
    "cleared_at": "2024-11-19T15:30:00Z",
    "circuit": "A",
    "source": "controller",
    "acknowledged": true,
    "acknowledged_by": "TECH-5844"
  },
  {
    "event_id": "EVT-2025-0445",
    "chiller_id": "CH-CHI-004",
    "alarm_code": "A1.01",
    "status": "cleared",
    "raised_at": "2025-07-22T12:45:00Z",
    "cleared_at": "2025-07-23T09:15:00Z",
    "circuit": "A",
    "source": "controller",
    "acknowledged": true,
    "acknowledged_by": "TECH-5587"
  }
]
